{
  "$schema": "https://json-schema.org/draft/2020-12/schema",
  "$id": "https://example.local/schemas/runtime_context.schema.json",
  "title": "RuntimeContextV1",
  "type": "object",
  "additionalProperties": false,
  "required": [
    "WORKFLOW_ID",
    "EXECUTION_ID",
    "WORKFLOW_VERSION",
    "EXECUTION_MODE",
    "REQUESTED_ACTION",
    "INPUT_ARTIFACTS",
    "REQUIRED_INVARIANTS",
    "ENVIRONMENT_TAG",
    "POLICY_SET_VERSION",
    "TIMESTAMP"
  ],
  "properties": {
    "WORKFLOW_ID": {
      "type": "string",
      "minLength": 1
    },
    "EXECUTION_ID": {
      "type": "string",
      "minLength": 1
    },
    "WORKFLOW_VERSION": {
      "type": "string",
      "minLength": 1
    },
    "EXECUTION_MODE": {
      "type": "string",
      "minLength": 1
    },
    "REQUESTED_ACTION": {
      "type": "string",
      "minLength": 1
    },
    "INPUT_ARTIFACTS": {
      "type": "array",
      "minItems": 1,
      "items": {
        "type": "object"
      }
    },
    "REQUIRED_INVARIANTS": {
      "type": "array",
      "minItems": 1,
      "items": {
        "type": "string",
        "minLength": 1
      }
    },
    "ENVIRONMENT_TAG": {
      "type": "string",
      "minLength": 1
    },
    "POLICY_SET_VERSION": {
      "type": "string",
      "minLength": 1
    },
    "TIMESTAMP": {
      "type": "string",
      "pattern": "^\\d{4}-\\d{2}-\\d{2}T\\d{2}:\\d{2}:\\d{2}Z$"
    },
    "OPTIONAL_METADATA": {
      "type": "object"
    }
  }
}